{
  "schema_version": "1.0",
  "source_id": "src-72d78523d81b049c",
  "language": "en",
  "records": [
    {
      "record_id": "manuk-r1",
      "name_raw": "MANUK FİLCANCIYAN EFENDİ",
      "segment_ids": [
        "s000001",
        "s000002",
        "s000003",
        "s000004",
        "s000005",
        "s000006",
        "s000007",
        "s000008",
        "s000009",
        "s000010",
        "s000011",
        "s000012"
      ],
      "facts": [
        {
          "fact_id": "manuk-r1-f001",
          "category": "identity",
          "key": "name_at_heading",
          "value_raw": "MANUK FİLCANCIYAN EFENDİ",
          "value": "Manuk Filcancıyan Efendi",
          "certainty": "direct",
          "evidence": [
            {
              "segment_id": "s000001",
              "quote": "MANUK FİLCANCIYAN EFENDİ (1259)"
            }
          ],
          "note": ""
        },
        {
          "fact_id": "manuk-r1-f002",
          "category": "source_annotation",
          "key": "heading_year_annotation",
          "value_raw": "1259",
          "value": 1259,
          "certainty": "direct",
          "evidence": [
            {
              "segment_id": "s000001",
              "quote": "MANUK FİLCANCIYAN EFENDİ (1259)"
            }
          ],
          "note": "The heading number is preserved as a source annotation; its function is not explicitly labelled here. The body separately states an AH 1259 birth."
        },
        {
          "fact_id": "manuk-r1-f003",
          "category": "family",
          "key": "father_name",
          "value_raw": "Karabet Ağa'nın",
          "value": "Karabet Ağa",
          "certainty": "direct",
          "evidence": [
            {
              "segment_id": "s000002",
              "quote": "Filcancı esnafından Karabet Ağa'nın oğludur."
            }
          ],
          "note": ""
        },
        {
          "fact_id": "manuk-r1-f004",
          "category": "family",
          "key": "father_trade_group",
          "value_raw": "Filcancı esnafından",
          "value": {
            "trade_raw": "Filcancı",
            "group_raw": "esnaf"
          },
          "certainty": "direct",
          "evidence": [
            {
              "segment_id": "s000002",
              "quote": "Filcancı esnafından Karabet Ağa'nın oğludur."
            }
          ],
          "note": "The trade wording is retained without choosing a modern occupational code or a more specific English translation."
        },
        {
          "fact_id": "manuk-r1-f005",
          "category": "birth",
          "key": "birth_date_statement",
          "value_raw": "Bin iki yüz elli dokuz sene-i Hicriyesi'nde",
          "value": {
            "hijri_year": 1259
          },
          "certainty": "direct",
          "evidence": [
            {
              "segment_id": "s000003",
              "quote": "Bin iki yüz elli dokuz sene-i Hicriyesi'nde Dersaadet'te tevellüt eylemiştir."
            }
          ],
          "note": "",
          "dates": [
            {
              "date_id": "manuk-r1-d001",
              "raw": "Bin iki yüz elli dokuz sene-i Hicriyesi'nde",
              "calendar": "hijri",
              "year": 1259,
              "month": null,
              "day": null,
              "precision": "year",
              "certainty": "direct",
              "evidence": [
                {
                  "segment_id": "s000003",
                  "quote": "Bin iki yüz elli dokuz sene-i Hicriyesi'nde Dersaadet'te tevellüt eylemiştir."
                }
              ],
              "note": "",
              "role": "birth"
            }
          ]
        },
        {
          "fact_id": "manuk-r1-f006",
          "category": "birth",
          "key": "birth_place",
          "value_raw": "Dersaadet'te",
          "value": "Dersaadet",
          "certainty": "direct",
          "evidence": [
            {
              "segment_id": "s000003",
              "quote": "Bin iki yüz elli dokuz sene-i Hicriyesi'nde Dersaadet'te tevellüt eylemiştir."
            }
          ],
          "note": ""
        },
        {
          "fact_id": "manuk-r1-f007",
          "category": "education",
          "key": "school",
          "value_raw": "Hasköy Ermeni Mektebi'nde",
          "value": "Hasköy Ermeni Mektebi",
          "certainty": "direct",
          "evidence": [
            {
              "segment_id": "s000004",
              "quote": "Hasköy Ermeni Mektebi'nde mukaddeme-i ulûmla hesap ve coğrafya ve tarih tahsil etmiştir. Fransızca okur, yazar, Ermenice kitabet ve Türkçe tekellüm eder."
            }
          ],
          "note": ""
        },
        {
          "fact_id": "manuk-r1-f008",
          "category": "education",
          "key": "subject_studied",
          "value_raw": "mukaddeme-i ulûmla",
          "value": "introductory learning",
          "certainty": "direct",
          "evidence": [
            {
              "segment_id": "s000004",
              "quote": "Hasköy Ermeni Mektebi'nde mukaddeme-i ulûmla hesap ve coğrafya ve tarih tahsil etmiştir. Fransızca okur, yazar, Ermenice kitabet ve Türkçe tekellüm eder."
            }
          ],
          "note": "",
          "details": {
            "school_fact_id": "manuk-r1-f007"
          }
        },
        {
          "fact_id": "manuk-r1-f009",
          "category": "education",
          "key": "subject_studied",
          "value_raw": "hesap",
          "value": "arithmetic",
          "certainty": "direct",
          "evidence": [
            {
              "segment_id": "s000004",
              "quote": "Hasköy Ermeni Mektebi'nde mukaddeme-i ulûmla hesap ve coğrafya ve tarih tahsil etmiştir. Fransızca okur, yazar, Ermenice kitabet ve Türkçe tekellüm eder."
            }
          ],
          "note": "",
          "details": {
            "school_fact_id": "manuk-r1-f007"
          }
        },
        {
          "fact_id": "manuk-r1-f010",
          "category": "education",
          "key": "subject_studied",
          "value_raw": "coğrafya",
          "value": "geography",
          "certainty": "direct",
          "evidence": [
            {
              "segment_id": "s000004",
              "quote": "Hasköy Ermeni Mektebi'nde mukaddeme-i ulûmla hesap ve coğrafya ve tarih tahsil etmiştir. Fransızca okur, yazar, Ermenice kitabet ve Türkçe tekellüm eder."
            }
          ],
          "note": "",
          "details": {
            "school_fact_id": "manuk-r1-f007"
          }
        },
        {
          "fact_id": "manuk-r1-f011",
          "category": "education",
          "key": "subject_studied",
          "value_raw": "tarih",
          "value": "history",
          "certainty": "direct",
          "evidence": [
            {
              "segment_id": "s000004",
              "quote": "Hasköy Ermeni Mektebi'nde mukaddeme-i ulûmla hesap ve coğrafya ve tarih tahsil etmiştir. Fransızca okur, yazar, Ermenice kitabet ve Türkçe tekellüm eder."
            }
          ],
          "note": "",
          "details": {
            "school_fact_id": "manuk-r1-f007"
          }
        },
        {
          "fact_id": "manuk-r1-f012",
          "category": "language",
          "key": "claimed_competence",
          "value_raw": "Fransızca okur",
          "value": {
            "language": "Fransızca",
            "competence": "reads"
          },
          "certainty": "direct",
          "evidence": [
            {
              "segment_id": "s000004",
              "quote": "Hasköy Ermeni Mektebi'nde mukaddeme-i ulûmla hesap ve coğrafya ve tarih tahsil etmiştir. Fransızca okur, yazar, Ermenice kitabet ve Türkçe tekellüm eder."
            }
          ],
          "note": "The stated mode is retained; no claim is made about unmentioned modes."
        },
        {
          "fact_id": "manuk-r1-f013",
          "category": "language",
          "key": "claimed_competence",
          "value_raw": "Fransızca okur, yazar",
          "value": {
            "language": "Fransızca",
            "competence": "writes"
          },
          "certainty": "direct",
          "evidence": [
            {
              "segment_id": "s000004",
              "quote": "Hasköy Ermeni Mektebi'nde mukaddeme-i ulûmla hesap ve coğrafya ve tarih tahsil etmiştir. Fransızca okur, yazar, Ermenice kitabet ve Türkçe tekellüm eder."
            }
          ],
          "note": "The stated mode is retained; no claim is made about unmentioned modes."
        },
        {
          "fact_id": "manuk-r1-f014",
          "category": "language",
          "key": "claimed_competence",
          "value_raw": "Ermenice kitabet",
          "value": {
            "language": "Ermenice",
            "competence": "writes"
          },
          "certainty": "direct",
          "evidence": [
            {
              "segment_id": "s000004",
              "quote": "Hasköy Ermeni Mektebi'nde mukaddeme-i ulûmla hesap ve coğrafya ve tarih tahsil etmiştir. Fransızca okur, yazar, Ermenice kitabet ve Türkçe tekellüm eder."
            }
          ],
          "note": "The stated mode is retained; no claim is made about unmentioned modes."
        },
        {
          "fact_id": "manuk-r1-f015",
          "category": "language",
          "key": "claimed_competence",
          "value_raw": "Türkçe tekellüm",
          "value": {
            "language": "Türkçe",
            "competence": "speaks"
          },
          "certainty": "direct",
          "evidence": [
            {
              "segment_id": "s000004",
              "quote": "Hasköy Ermeni Mektebi'nde mukaddeme-i ulûmla hesap ve coğrafya ve tarih tahsil etmiştir. Fransızca okur, yazar, Ermenice kitabet ve Türkçe tekellüm eder."
            }
          ],
          "note": "The stated mode is retained; no claim is made about unmentioned modes."
        },
        {
          "fact_id": "manuk-r1-f016",